{
  "version_ri": 1,
  "empreinte_physique": "sha256:0000000000000000000000000000000000000000000000000000000000000015",
  "espace_de_noms": "App\\Entity",
  "entites": [
    {
      "nom": "Personne",
      "table": {
        "nom": "personne",
        "schema": "public"
      },
      "valeur_discriminante": "P",
      "identifiant": {
        "proprietes": [
          "id"
        ],
        "strategie": "identite"
      },
      "proprietes": [
        {
          "nom": "id",
          "colonne": "id",
          "type_php": "int",
          "type_doctrine": "integer",
          "nullable": false,
          "origine": "contrainte"
        },
        {
          "nom": "nom",
          "colonne": "nom",
          "type_php": "string",
          "type_doctrine": "string",
          "nullable": false,
          "longueur": 80,
          "origine": "contrainte"
        },
        {
          "nom": "nature",
          "colonne": "nature",
          "type_php": "string",
          "type_doctrine": "string",
          "nullable": false,
          "longueur": 1,
          "origine": "contrainte"
        }
      ],
      "associations": [
        {
          "nom": "prestataire",
          "genre": "un_vers_un",
          "cible": "Prestataire",
          "proprietaire": false,
          "mappee_par": "personne",
          "origine": "contrainte"
        },
        {
          "nom": "adresse",
          "genre": "un_vers_plusieurs",
          "cible": "Adresse",
          "proprietaire": false,
          "mappee_par": "personne",
          "origine": "contrainte"
        }
      ],
      "commentaire": "La racine porte la colonne qui dit quelle classe chaque ligne instancie",
      "origine": "nommage"
    },
    {
      "nom": "Salarie",
      "table": {
        "nom": "salarie",
        "schema": "public"
      },
      "heritage": {
        "strategie": "jointe",
        "parent": "Personne",
        "colonne_discriminante": "nature",
        "origine": "decision"
      },
      "valeur_discriminante": "S",
      "identifiant": {
        "proprietes": [
          "id"
        ],
        "strategie": "assignee"
      },
      "proprietes": [
        {
          "nom": "id",
          "colonne": "id",
          "type_php": "int",
          "type_doctrine": "integer",
          "nullable": false,
          "origine": "contrainte"
        },
        {
          "nom": "matricule",
          "colonne": "matricule",
          "type_php": "string",
          "type_doctrine": "string",
          "nullable": false,
          "longueur": 20,
          "origine": "contrainte"
        }
      ],
      "associations": [
        {
          "nom": "affectation",
          "genre": "un_vers_plusieurs",
          "cible": "Affectation",
          "proprietaire": false,
          "mappee_par": "salarie",
          "origine": "contrainte"
        }
      ],
      "commentaire": "Déclaré enfant de personne par le fichier de décisions",
      "origine": "nommage"
    },
    {
      "nom": "Prestataire",
      "table": {
        "nom": "prestataire",
        "schema": "public"
      },
      "identifiant": {
        "proprietes": [
          "id"
        ],
        "strategie": "assignee"
      },
      "proprietes": [
        {
          "nom": "id",
          "colonne": "id",
          "type_php": "int",
          "type_doctrine": "integer",
          "nullable": false,
          "origine": "contrainte"
        },
        {
          "nom": "societe",
          "colonne": "societe",
          "type_php": "string",
          "type_doctrine": "string",
          "nullable": false,
          "longueur": 120,
          "origine": "contrainte"
        }
      ],
      "associations": [
        {
          "nom": "personne",
          "genre": "un_vers_un",
          "cible": "Personne",
          "proprietaire": true,
          "inversee_par": "prestataire",
          "jointure": [
            {
              "colonne": "id",
              "colonne_referencee": "id",
              "nullable": false,
              "a_la_suppression": "cascade"
            }
          ],
          "origine": "contrainte"
        }
      ],
      "commentaire": "Absent des valeurs décidées : garde son un-vers-un",
      "origine": "nommage"
    },
    {
      "nom": "Adresse",
      "table": {
        "nom": "adresse",
        "schema": "public"
      },
      "identifiant": {
        "proprietes": [
          "id"
        ],
        "strategie": "identite"
      },
      "proprietes": [
        {
          "nom": "id",
          "colonne": "id",
          "type_php": "int",
          "type_doctrine": "integer",
          "nullable": false,
          "origine": "contrainte"
        },
        {
          "nom": "personneId",
          "colonne": "personne_id",
          "type_php": "int",
          "type_doctrine": "integer",
          "nullable": false,
          "origine": "contrainte"
        },
        {
          "nom": "ville",
          "colonne": "ville",
          "type_php": "string",
          "type_doctrine": "string",
          "nullable": false,
          "longueur": 60,
          "origine": "contrainte"
        }
      ],
      "associations": [
        {
          "nom": "personne",
          "genre": "plusieurs_vers_un",
          "cible": "Personne",
          "proprietaire": true,
          "inversee_par": "adresse",
          "jointure": [
            {
              "colonne": "personne_id",
              "colonne_referencee": "id",
              "nullable": false
            }
          ],
          "origine": "contrainte"
        }
      ],
      "commentaire": "Vise la racine : la collection vit dans la classe de base de personne",
      "origine": "nommage"
    },
    {
      "nom": "Affectation",
      "table": {
        "nom": "affectation",
        "schema": "public"
      },
      "identifiant": {
        "proprietes": [
          "salarieId",
          "debut"
        ],
        "strategie": "assignee"
      },
      "proprietes": [
        {
          "nom": "salarieId",
          "colonne": "salarie_id",
          "type_php": "int",
          "type_doctrine": "integer",
          "nullable": false,
          "origine": "contrainte"
        },
        {
          "nom": "debut",
          "colonne": "debut",
          "type_php": "\\DateTimeImmutable",
          "type_doctrine": "date_immutable",
          "nullable": false,
          "origine": "contrainte"
        },
        {
          "nom": "service",
          "colonne": "service",
          "type_php": "string",
          "type_doctrine": "string",
          "nullable": false,
          "longueur": 60,
          "origine": "contrainte"
        }
      ],
      "associations": [
        {
          "nom": "salarie",
          "genre": "plusieurs_vers_un",
          "cible": "Salarie",
          "proprietaire": true,
          "inversee_par": "affectation",
          "jointure": [
            {
              "colonne": "salarie_id",
              "colonne_referencee": "id",
              "nullable": false
            }
          ],
          "origine": "contrainte"
        }
      ],
      "commentaire": "Identifiée par salarie : possible une fois salarie déclaré enfant, sa clé devenant celle de personne",
      "origine": "nommage"
    }
  ],
  "avertissements": [
    {
      "code": "cle_primaire_composite",
      "cible": "public.affectation",
      "message": "clé primaire sur salarieId, debut",
      "resolution": "par_defaut",
      "confiance": 1
    },
    {
      "code": "heritage_deduit",
      "cible": "public.prestataire",
      "message": "clé primaire portant une clé étrangère vers Personne : reliée par un-vers-un, sans héritage. Pour l'inclure dans l'héritage déclaré, ajouter public.prestataire aux valeurs de heritages: public.personne",
      "resolution": "par_defaut",
      "confiance": 0.7
    }
  ]
}
